outputs/tables/portfolio_risk_metrics.csv

,Annualized Return,Annualized Volatility,Sharpe Ratio,Maximum Drawdown,VaR (95%),CVaR (95%)
Equal Weight,0.07890212959957182,0.09373231118689344,0.6284079508305999,-0.20736333852953626,0.008470935849952066,0.013622252113482603
Minimum Variance,0.018691724691240145,0.015554283864884569,-0.08411028885189788,-0.05996601393226486,0.0013403371945237997,0.002218216637547286
Maximum Sharpe,0.04132701817225978,0.10902732500067117,0.19561167966038326,-0.3409094902610105,0.010965662157870116,0.01798080898854795
Risk Parity,0.04965539628647814,0.051752710070464066,0.5730211277071431,-0.14871555428194017,0.004676594161664893,0.008000725461406576

README.md

## Key Investment Findings

The Equal Weight portfolio generated the highest out-of-sample annualized return (7.89%) and Sharpe ratio (0.63), highlighting the potential limitations of optimization based on historical estimates.

The strategy experienced 1.56% annualized volatility and a maximum historical drawdown of 6.00%, although its return was relatively low.

Risk Parity generated a 4.97% gross annualized return with 5.18% volatility and a maximum drawdown of 14.87%.